{
  "schema_version": "2.0-rc1",
  "issue_id": "2026-W43",
  "evidence_task_id": "evidence:2026-W43:e79cd46ed4df7c56",
  "discovery_ids": [
    "w43-lead-muse-10m-20261021"
  ],
  "source_records": [
    {
      "source_type": "SECONDARY",
      "collector_id": "primary-webfetch",
      "collector_run_id": "20261024T120000Z-muse-r1",
      "observed_at": "2026-10-24T12:36:18Z",
      "title": "Meta Muse 10M users, shopping top activity (Oct 21 earnings)",
      "locator": "secondary:techcrunch.com/2026/10/21/meta-says-muse-has-over-10m-users-with-shopping-a-top-activity",
      "raw_paths": [
        "sources/2026-W43/collectors/primary/runs/20261024T120000Z-muse-r1/bundle-01-frontier-agents-20261021-23.md"
      ],
      "published_at": "2026-10-21",
      "summary_text": "Q3 call: 10M+ Muse; shopping top; agentic purchase framing; industry signal only.",
      "metadata": {
        "authority_class": "FIRST_PARTY_ANNOUNCEMENT_OR_DOC",
        "capture_class": "SEARCH_CONFIRMED_CLAIM_NOTE__FULL_BODY_UNCONSUMED",
        "observed_basis": "BOUNDED_COLLECTION_R1_PROPOSED_NOT_ACCEPTED",
        "temporal": "ORDINARY",
        "r3_reverified_at": "2026-10-24T12:36:18Z",
        "r3_status": "ACTIVE_CANONICAL"
      }
    }
  ],
  "verification_targets": [
    "earnings-transcript",
    "sensor-tower-methodology",
    "spend-figure-basis"
  ],
  "screening_basis": {
    "screening_acceptance_sha256": "566cde3bd287dffb38d705c4b6c3fec71a98f67dea96016a009bd929923be48a",
    "decisions": [
      {
        "discovery_id": "w43-lead-muse-10m-20261021",
        "decision": "MAYBE",
        "scope_tags": [
          "current-relevance",
          "industry-context"
        ]
      }
    ]
  }
}
