{
  "schema_version": "2.0-rc1",
  "issue_id": "SP-vision-multimodal-2026",
  "evidence_task_id": "evidence:SP-vision-multimodal-2026:a3d0f0452d7e3282",
  "discovery_ids": [
    "VM-D029"
  ],
  "source_records": [
    {
      "source_type": "arxiv_primary",
      "collector_id": "muse-primary-web",
      "collector_run_id": "vision-multimodal-discovery-r1",
      "observed_at": "2026-09-30T00:38:52Z",
      "title": "Qwen3-VL-Embedding and Qwen3-VL-Reranker",
      "locator": "https://arxiv.org/abs/2601.04720",
      "raw_paths": [
        "sources/SP-vision-multimodal-2026/raw/discovery-observations-vmo05.md"
      ],
      "published_at": "2026-01",
      "summary_text": "VLM-backbone retrieval: MMEB-V2 77.8 (author-measured, Jan 2026); Matryoshka + quantization-aware deployment traits; D05 retrieval sub-lane + D09 encoder-reuse cross-ref. [retrieval: ARXIV_ABSTRACT_VERIFIED; full-body consumption at Evidence stage]",
      "metadata": {
        "lane": "d05",
        "modality": "multimodal",
        "role": "retrieval-sub-lane",
        "x_axes": [
          "X01",
          "X02"
        ],
        "ts_overlap": "TS-001 absent / TS-002 absent",
        "retrieval_status": "ARXIV_ABSTRACT_VERIFIED",
        "evidence_boundary": "source-local claims only until Evidence verification",
        "scope_limitation": "ID re-verified at intake (API title match); leaderboard claim is author-measured.",
        "source_role": "ARCHITECTURE_CASE + EVALUATION_CASE (author-measured)"
      }
    }
  ],
  "verification_targets": [
    "Evidence-stage full-body verification",
    "preprint version/status binding"
  ],
  "screening_basis": {
    "screening_acceptance_sha256": "3bc6edb4c60ad6fba40626b0900f6cf5656544b98a95e4b3d4415f049d3f1a94",
    "decisions": [
      {
        "discovery_id": "VM-D029",
        "decision": "KEEP",
        "scope_tags": [
          "VM-O05",
          "VM-O10"
        ]
      }
    ]
  }
}
