{
  "schema_version": "2.0-rc1",
  "issue_id": "SP-vision-multimodal-2026",
  "evidence_task_id": "evidence:SP-vision-multimodal-2026:8b9c3bd9b50fd8e7",
  "discovery_ids": [
    "VM-D095"
  ],
  "source_records": [
    {
      "source_type": "arxiv_primary",
      "collector_id": "muse-primary-web",
      "collector_run_id": "vision-multimodal-discovery-r1",
      "observed_at": "2026-09-30T00:38:52Z",
      "title": "PaLM-E (Driess et al.)",
      "locator": "https://arxiv.org/abs/2303.03378",
      "raw_paths": [
        "sources/SP-vision-multimodal-2026/raw/discovery-observations-vmo14.md"
      ],
      "published_at": "2023-03",
      "summary_text": "Embodied joint representation: continuous sensor observations into the LM embedding space (the VLM-into-body break). [retrieval: ARXIV_ABSTRACT_VERIFIED; full-body consumption at Evidence stage]",
      "metadata": {
        "lane": "d13",
        "modality": "vision-language-action",
        "role": "predecessor-node",
        "x_axes": [
          "X02"
        ],
        "ts_overlap": "TS-001 absent / TS-002 absent",
        "retrieval_status": "ARXIV_ABSTRACT_VERIFIED",
        "evidence_boundary": "source-local claims only until Evidence verification",
        "scope_limitation": "ID verified at intake (API title match)."
      }
    }
  ],
  "verification_targets": [
    "Evidence-stage full-body verification"
  ],
  "screening_basis": {
    "screening_acceptance_sha256": "2b50dd1c205efc957c16a848fe185f9de7fb5eca10a5729c1b58c5bb250e7aff",
    "decisions": [
      {
        "discovery_id": "VM-D095",
        "decision": "KEEP",
        "scope_tags": [
          "VM-O14"
        ]
      }
    ]
  }
}
