{
  "schema_version": "2.0-rc1",
  "issue_id": "SP-vision-multimodal-2026",
  "evidence_task_id": "evidence:SP-vision-multimodal-2026:83eb37cf4723f9fb",
  "discovery_ids": [
    "VM-D046"
  ],
  "source_records": [
    {
      "source_type": "arxiv_primary",
      "collector_id": "muse-primary-web",
      "collector_run_id": "vision-multimodal-discovery-r1",
      "observed_at": "2026-09-30T00:38:52Z",
      "title": "Detecting Twenty-thousand Classes using Image-level Supervision / Detic (Zhou et al.)",
      "locator": "https://arxiv.org/abs/2201.02605",
      "raw_paths": [
        "sources/SP-vision-multimodal-2026/raw/discovery-observations-vmo08.md"
      ],
      "published_at": "2022-01",
      "summary_text": "Image-level (ImageNet-21K) classifier training via max-size-proposal assignment; vocabulary-scaling pole. [retrieval: ARXIV_ABSTRACT_VERIFIED; full-body consumption at Evidence stage]",
      "metadata": {
        "lane": "d07b",
        "modality": "image-text",
        "role": "variant-node",
        "x_axes": [
          "X01"
        ],
        "ts_overlap": "TS-001 absent / TS-002 absent",
        "retrieval_status": "ARXIV_ABSTRACT_VERIFIED",
        "evidence_boundary": "source-local claims only until Evidence verification",
        "scope_limitation": "ID corrected at intake (Round B guess 2201.12280 wrong); assignment heuristic is the load-bearing detail.",
        "repo": "https://github.com/facebookresearch/detic"
      }
    }
  ],
  "verification_targets": [
    "Evidence-stage full-body verification"
  ],
  "screening_basis": {
    "screening_acceptance_sha256": "7c76cdb6214e01ac88280ab7c85f0488951ddaf6b5bc9b0229b4d97acb795868",
    "decisions": [
      {
        "discovery_id": "VM-D046",
        "decision": "KEEP",
        "scope_tags": [
          "VM-O08"
        ]
      }
    ]
  }
}
