{
  "schema_version": "2.0-rc1",
  "issue_id": "SP-efficient-llm-2026",
  "evidence_task_id": "evidence:SP-efficient-llm-2026:f7421a7add4c658b",
  "discovery_ids": [
    "EFF-D102"
  ],
  "source_records": [
    {
      "source_type": "PRIMARY_PAPER",
      "collector_id": "chatgpt-primary-web",
      "collector_run_id": "efficient-llm-discovery-r2",
      "observed_at": "2026-09-21T17:30:00Z",
      "title": "GPipe (pipeline parallelism)",
      "locator": "https://arxiv.org/abs/1811.06965",
      "raw_paths": [
        "sources/SP-efficient-llm-2026/raw/discovery-observations-r2-g12-distributed-training.md"
      ],
      "published_at": "2018-11",
      "summary_text": "Micro-batch pipeline + recompute; bubble/memory tradeoff origin. [retrieval: SUMMARY_CAPTURED; full-body consumption at Evidence stage]",
      "metadata": {
        "lane": "g12",
        "expansion": "r2",
        "evidence_boundary": "source-local claims only until Evidence verification",
        "retrieval_status": "SUMMARY_CAPTURED"
      }
    }
  ],
  "verification_targets": [
    "Evidence-stage full-body verification"
  ],
  "screening_basis": {
    "screening_acceptance_sha256": "65330476ff975c49fb4510f56d27942ec2b334b8ceed8a66b00639c659ec24fe",
    "decisions": [
      {
        "discovery_id": "EFF-D102",
        "decision": "KEEP",
        "scope_tags": [
          "scaling-training"
        ]
      }
    ]
  }
}
