{
  "schema_version": "2.0-rc1",
  "issue_id": "SP-beyond-text-2026",
  "evidence_task_id": "evidence:SP-beyond-text-2026:fee3ed39d2856267",
  "discovery_ids": [
    "BT-D071"
  ],
  "source_records": [
    {
      "source_type": "PRIMARY_PAPER",
      "collector_id": "muse-primary-web",
      "collector_run_id": "beyond-text-discovery-r1",
      "observed_at": "2026-09-23T17:30:00Z",
      "title": "Imagen Video: High Definition Video Generation with Diffusion Models (Ho et al.)",
      "locator": "https://arxiv.org/abs/2210.02303",
      "raw_paths": [
        "sources/SP-beyond-text-2026/raw/discovery-observations-d09-video.md"
      ],
      "published_at": "2022-10",
      "summary_text": "Cascaded spatial+temporal super-resolution video diffusion; duration/resolution scaling design. [retrieval: SUMMARY_CAPTURED; full-body consumption at Evidence stage]",
      "metadata": {
        "lane": "d09",
        "modality": "video",
        "role": "anchor",
        "evidence_boundary": "source-local claims only until Evidence verification",
        "retrieval_status": "SUMMARY_CAPTURED",
        "scope_limitation": "Cascade cost needs latent-video successors."
      }
    }
  ],
  "verification_targets": [
    "Evidence-stage full-body verification"
  ],
  "screening_basis": {
    "screening_acceptance_sha256": "d8eaabe990ab3420e30bb852909afc684b1339ae9779dab0519c04dacd9ecc1a",
    "decisions": [
      {
        "discovery_id": "BT-D071",
        "decision": "KEEP",
        "scope_tags": [
          "BT-O06",
          "BT-O09"
        ]
      }
    ]
  }
}
