{
  "schema_version": "2.0-rc1",
  "issue_id": "2026-W34",
  "evidence_task_id": "evidence:2026-W34:17bdb30024304d1e",
  "discovery_ids": [
    "w34-event-c043"
  ],
  "source_records": [
    {
      "collector_id": "dailyx-drive-import",
      "collector_run_id": "dailyx-w34-exact-import-20260902T173601Z",
      "locator": "https://drive.google.com/open?id=18Bzcctb1ZDXPBq8diQaE5Dfj-f89fgr3",
      "metadata": {
        "authority_class": "DISCOVERY_AND_COMMUNITY_SIGNAL_ONLY",
        "authority_qualifier": "primary_source_class=X_OBSERVATION_ONLY; status_qualifier=KEEP_CANDIDATE / COMMUNITY_PROJECT; X_OR_COMMUNITY_RAW_DISCOVERY_ONLY; technical_evidence_accepted=false",
        "capture_mode": "DRIVE_RAW_DOWNLOAD",
        "chronology_qualifier": "INVENTORY_CHRONOLOGY_PRESERVED",
        "crosswalk_path": "sources/2026-W34/screening/input/event-discovery-crosswalk-v0.1.json",
        "crosswalk_sha256": "34491ec5f4620f25cdaff4ebe61f7cc92b02fe7f7cfebfdcb548a6347672e4ff",
        "drive_byte_count": 13735,
        "drive_file_id": "18Bzcctb1ZDXPBq8diQaE5Dfj-f89fgr3",
        "drive_folder_id": "1VVAqP1ylgywdrOfl2ghS9l00yiu7ThtY",
        "event_id": "W34-C043",
        "event_level_discovery_id": "w34-event-c043",
        "event_level_expansion": true,
        "exact_returned_bytes": true,
        "lane": "Local AI / Quantization",
        "mime_type": "text/plain",
        "next_verification": "Third-party packaging/optimization; verify artifact timestamp and technical deltas before Evidence.",
        "original_http_bytes_claimed": false,
        "pre_screening_status": "KEEP_CANDIDATE / COMMUNITY_PROJECT",
        "provider_returned_file_name": "2026-08-18_0700.md.txt",
        "screening_decision_present": false,
        "selected_source_parent": "w34-dailyx-20260818-0700",
        "sha256": "c299b0960af229c83f388450d65365b31435136c295318323930418272ccddaf",
        "source_filename": "2026-08-18_0700.md",
        "source_layers": "DailyX",
        "technical_evidence_accepted": false
      },
      "observed_at": "2026-08-17T22:00:00Z",
      "published_at": null,
      "raw_paths": [
        "sources/2026-W34/intake/working-set/sol-discovery-event-inventory-v0.2.md",
        "sources/2026-W34/external/x/dailyx/raw/2026-08-18_0700.md",
        "sources/2026-W34/external/x/dailyx/raw/2026-08-21_0700.md",
        "sources/2026-W34/external/x/weekly-x-2026-W34-r2/raw/grok-x-result.corrected.md",
        "sources/2026-W34/external/x/weekly-x-2026-W34-r2/raw/x-url-ledger.corrected.tsv"
      ],
      "source_type": "dailyx_x_observation",
      "summary_text": "Third-party packaging/optimization; verify artifact timestamp and technical deltas before Evidence.",
      "title": "Qwen3.8 Unsloth/GGUF optimization"
    }
  ],
  "verification_targets": [
    "Third-party packaging/optimization; verify artifact timestamp and technical deltas before Evidence."
  ],
  "screening_basis": {
    "screening_acceptance_sha256": "04743e36762b58e6d850f6a63c89470f6f4f1c8ba0f80c76426e686b629bbee9",
    "decisions": [
      {
        "discovery_id": "w34-event-c043",
        "decision": "INSPECT",
        "scope_tags": [
          "local-ai",
          "quantization"
        ]
      }
    ]
  }
}
