{
  "schema_version": "2.0-rc1",
  "issue_id": "SP-vision-multimodal-2026",
  "evidence_task_id": "evidence:SP-vision-multimodal-2026:b049264287440eba",
  "discovery_ids": [
    "VM-D060"
  ],
  "source_records": [
    {
      "source_type": "arxiv_primary",
      "collector_id": "muse-primary-web",
      "collector_run_id": "vision-multimodal-discovery-r1",
      "observed_at": "2026-09-30T00:38:52Z",
      "title": "InstructBLIP (Dai et al.)",
      "locator": "https://arxiv.org/abs/2305.06500",
      "raw_paths": [
        "sources/SP-vision-multimodal-2026/raw/discovery-observations-vmo09.md"
      ],
      "published_at": "2023-05",
      "summary_text": "Instruction-tuning bridge BLIP-2 to LLaVA; fills the Sol-map predecessor gap. [retrieval: ARXIV_ABSTRACT_VERIFIED; full-body consumption at Evidence stage]",
      "metadata": {
        "lane": "d08",
        "modality": "image-text",
        "role": "bridge-node",
        "x_axes": [
          "X01"
        ],
        "ts_overlap": "TS-001 absent / TS-002 absent",
        "retrieval_status": "ARXIV_ABSTRACT_VERIFIED",
        "evidence_boundary": "source-local claims only until Evidence verification",
        "scope_limitation": "ID verified at intake (API title match)."
      }
    }
  ],
  "verification_targets": [
    "Evidence-stage full-body verification"
  ],
  "screening_basis": {
    "screening_acceptance_sha256": "e471c40158c226d150bf18bf68a5da46a8ad8710d5df3d063eab23f32f5863d9",
    "decisions": [
      {
        "discovery_id": "VM-D060",
        "decision": "KEEP",
        "scope_tags": [
          "VM-O09"
        ]
      }
    ]
  }
}
