{
  "schema_version": "2.0-rc1",
  "issue_id": "SP-vision-multimodal-2026",
  "evidence_task_id": "evidence:SP-vision-multimodal-2026:85268ad1dbd5f285",
  "discovery_ids": [
    "VM-D090"
  ],
  "source_records": [
    {
      "source_type": "arxiv_primary",
      "collector_id": "muse-primary-web",
      "collector_run_id": "vision-multimodal-discovery-r1",
      "observed_at": "2026-09-30T00:38:52Z",
      "title": "OSWorld (Xie et al.)",
      "locator": "https://arxiv.org/abs/2404.07972",
      "raw_paths": [
        "sources/SP-vision-multimodal-2026/raw/discovery-observations-vmo13.md"
      ],
      "published_at": "2024-04",
      "summary_text": "Real-OS multimodal-agent environment + 369-task benchmark; grounding-bottleneck thesis (best 12.24% vs human 72.36%); NeurIPS 2024. [retrieval: ARXIV_ABSTRACT_VERIFIED; full-body consumption at Evidence stage]",
      "metadata": {
        "lane": "d12",
        "modality": "screenshot",
        "role": "anchor",
        "x_axes": [
          "X02",
          "X04"
        ],
        "ts_overlap": "TS-001 partial / TS-002 absent",
        "retrieval_status": "ARXIV_ABSTRACT_VERIFIED",
        "evidence_boundary": "source-local claims only until Evidence verification",
        "scope_limitation": "Short-horizon scope; long-horizon thesis needs 2.0-side sources.",
        "repo": "https://github.com/xlang-ai/OSWorld"
      }
    }
  ],
  "verification_targets": [
    "Evidence-stage full-body verification"
  ],
  "screening_basis": {
    "screening_acceptance_sha256": "3bc6edb4c60ad6fba40626b0900f6cf5656544b98a95e4b3d4415f049d3f1a94",
    "decisions": [
      {
        "discovery_id": "VM-D090",
        "decision": "KEEP",
        "scope_tags": [
          "VM-O13"
        ]
      }
    ]
  }
}
