{
  "schema_version": "2.0-rc1",
  "issue_id": "SP-vision-multimodal-2026",
  "evidence_task_id": "evidence:SP-vision-multimodal-2026:b10c9e111b6ab1e8",
  "discovery_ids": [
    "VM-D011"
  ],
  "source_records": [
    {
      "source_type": "arxiv_primary",
      "collector_id": "muse-primary-web",
      "collector_run_id": "vision-multimodal-discovery-r1",
      "observed_at": "2026-09-30T00:38:52Z",
      "title": "DINO: DETR with Improved DeNoising Anchor Boxes (Zhang et al.)",
      "locator": "https://arxiv.org/abs/2203.03605",
      "raw_paths": [
        "sources/SP-vision-multimodal-2026/raw/discovery-observations-vmo02.md"
      ],
      "published_at": "2022-03",
      "summary_text": "DETR-lineage capstone and the technical base of Grounding DINO. ALWAYS qualify vs DINO self-supervised (CV2-DM-006 rule). [retrieval: ARXIV_ABSTRACT_VERIFIED; full-body consumption at Evidence stage]",
      "metadata": {
        "lane": "d02",
        "modality": "image",
        "role": "successor-node",
        "x_axes": [
          "X02"
        ],
        "ts_overlap": "TS-001 absent / TS-002 absent",
        "retrieval_status": "ARXIV_ABSTRACT_VERIFIED",
        "evidence_boundary": "source-local claims only until Evidence verification",
        "scope_limitation": "Name collision hazard; every prose occurrence must carry the detector qualifier."
      }
    }
  ],
  "verification_targets": [
    "Evidence-stage full-body verification",
    "DINO detector vs self-supervised disambiguation"
  ],
  "screening_basis": {
    "screening_acceptance_sha256": "3bc6edb4c60ad6fba40626b0900f6cf5656544b98a95e4b3d4415f049d3f1a94",
    "decisions": [
      {
        "discovery_id": "VM-D011",
        "decision": "KEEP",
        "scope_tags": [
          "VM-O02",
          "VM-O08"
        ]
      }
    ]
  }
}
