{
  "schema_version": "2.0-rc1",
  "issue_id": "SP-vision-multimodal-2026",
  "evidence_task_id": "evidence:SP-vision-multimodal-2026:4ca2413b8167abe8",
  "discovery_ids": [
    "VM-D023"
  ],
  "source_records": [
    {
      "source_type": "arxiv_primary",
      "collector_id": "muse-primary-web",
      "collector_run_id": "vision-multimodal-discovery-r1",
      "observed_at": "2026-09-30T00:38:52Z",
      "title": "LayoutLM (Xu et al.)",
      "locator": "https://arxiv.org/abs/1912.13318",
      "raw_paths": [
        "sources/SP-vision-multimodal-2026/raw/discovery-observations-vmo05.md"
      ],
      "published_at": "2019-12",
      "summary_text": "Text+layout+position pre-training origin for document understanding. [retrieval: ARXIV_ABSTRACT_VERIFIED; full-body consumption at Evidence stage]",
      "metadata": {
        "lane": "d05",
        "modality": "document",
        "role": "anchor",
        "x_axes": [
          "X01",
          "X02"
        ],
        "ts_overlap": "TS-001 absent / TS-002 absent",
        "retrieval_status": "ARXIV_ABSTRACT_VERIFIED",
        "evidence_boundary": "source-local claims only until Evidence verification",
        "scope_limitation": "Base-version scope; unified successors need v3-side sources."
      }
    }
  ],
  "verification_targets": [
    "Evidence-stage full-body verification"
  ],
  "screening_basis": {
    "screening_acceptance_sha256": "2b50dd1c205efc957c16a848fe185f9de7fb5eca10a5729c1b58c5bb250e7aff",
    "decisions": [
      {
        "discovery_id": "VM-D023",
        "decision": "KEEP",
        "scope_tags": [
          "VM-O05"
        ]
      }
    ]
  }
}
