{
  "schema_version": "2.0-rc1",
  "issue_id": "SP-vision-multimodal-2026",
  "evidence_task_id": "evidence:SP-vision-multimodal-2026:430f58620318dee9",
  "discovery_ids": [
    "VM-D017"
  ],
  "source_records": [
    {
      "source_type": "arxiv_primary",
      "collector_id": "muse-primary-web",
      "collector_run_id": "vision-multimodal-discovery-r1",
      "observed_at": "2026-09-30T00:38:52Z",
      "title": "Segment Anything (Kirillov et al.)",
      "locator": "https://arxiv.org/abs/2304.02643",
      "raw_paths": [
        "sources/SP-vision-multimodal-2026/raw/discovery-observations-vmo03.md"
      ],
      "published_at": "2023-04",
      "summary_text": "Promptable task/model/SA-1B (>1B masks) system explicitly targeting zero-shot transfer; first vision-foundation-model event. [retrieval: ARXIV_ABSTRACT_VERIFIED; full-body consumption at Evidence stage]",
      "metadata": {
        "lane": "d03",
        "modality": "image",
        "role": "anchor",
        "x_axes": [
          "X01",
          "X02"
        ],
        "ts_overlap": "TS-001 absent / TS-002 absent",
        "retrieval_status": "ARXIV_ABSTRACT_VERIFIED",
        "evidence_boundary": "source-local claims only until Evidence verification",
        "scope_limitation": "Carry BOTH readings (foundation model vs task-bounded annotation engine); downstream evals adjudicate per task.",
        "repo": "https://github.com/facebookresearch/segment-anything"
      }
    }
  ],
  "verification_targets": [
    "Evidence-stage full-body verification"
  ],
  "screening_basis": {
    "screening_acceptance_sha256": "c851605b219be55c746671e950a808b0f6821a514600b0e0d7fd582e9298b603",
    "decisions": [
      {
        "discovery_id": "VM-D017",
        "decision": "KEEP",
        "scope_tags": [
          "VM-O03"
        ]
      }
    ]
  }
}
