{
  "schema_version": "2.0-rc1",
  "issue_id": "2026-W39",
  "evidence_task_id": "evidence:2026-W39:69420b25f1b793e8",
  "discovery_ids": [
    "w39-primary-enzyme-art-20260923"
  ],
  "source_records": [
    {
      "collector_id": "primary-webfetch",
      "collector_run_id": "w39-primary-20260927-r1",
      "locator": "primary:anthropic.com/news/claude-discovers-novel-enzyme-system",
      "metadata": {},
      "observed_at": "2026-09-27T18:50:00Z",
      "published_at": "2026-09-23T12:00:00Z",
      "raw_paths": [
        "sources/2026-W39/collectors/primary/runs/20260927T185000Z/anthropic-enzyme-art-20260923.md"
      ],
      "source_type": "PRIMARY_OFFICIAL",
      "summary_text": "Life-sciences lab + ART discovery; 950 agents/21h/210M tokens; function unknown; pre-print unreviewed; autonomy boundary explicit.",
      "title": "Anthropic: Claude-discovered ART enzyme system (Sep 23)"
    }
  ],
  "verification_targets": [
    "anthropic-enzyme-preprint"
  ],
  "screening_basis": {
    "screening_acceptance_sha256": "aee84b5afdc469cbe86acb8bec70eb0967af67e19970667178631f8e3d1aac36",
    "decisions": [
      {
        "discovery_id": "w39-primary-enzyme-art-20260923",
        "decision": "KEEP",
        "scope_tags": [
          "science",
          "agents"
        ]
      }
    ]
  }
}
