{
  "schema_version": "2.0-rc1",
  "issue_id": "SP-beyond-text-2026",
  "evidence_task_id": "evidence:SP-beyond-text-2026:88f2354f17f87ab2",
  "discovery_ids": [
    "BT-D044"
  ],
  "source_records": [
    {
      "source_type": "PRIMARY_PAPER",
      "collector_id": "muse-primary-web",
      "collector_run_id": "beyond-text-discovery-r1",
      "observed_at": "2026-09-23T17:30:00Z",
      "title": "SDEdit: Guided Image Synthesis and Editing with SDEs (Meng et al.)",
      "locator": "https://arxiv.org/abs/2108.01073",
      "raw_paths": [
        "sources/SP-beyond-text-2026/raw/discovery-observations-d05-editing.md"
      ],
      "published_at": "2021-08",
      "summary_text": "Noise-then-denoise stroke/image-guided editing; the editing-as-partial-diffusion formulation. [retrieval: SUMMARY_CAPTURED; full-body consumption at Evidence stage]",
      "metadata": {
        "lane": "d05",
        "modality": "image",
        "role": "anchor",
        "evidence_boundary": "source-local claims only until Evidence verification",
        "retrieval_status": "SUMMARY_CAPTURED",
        "scope_limitation": "Stroke-fidelity limits need inpainting successors."
      }
    }
  ],
  "verification_targets": [
    "Evidence-stage full-body verification"
  ],
  "screening_basis": {
    "screening_acceptance_sha256": "826833e88e851f69e5bd76a3d2558f0bb4a659aed49bf25e404e0cda1bf6be79",
    "decisions": [
      {
        "discovery_id": "BT-D044",
        "decision": "KEEP",
        "scope_tags": [
          "BT-O05"
        ]
      }
    ]
  }
}
