{
  "schema_version": "2.0-rc1",
  "issue_id": "SP-beyond-text-2026",
  "evidence_task_id": "evidence:SP-beyond-text-2026:6cc7c8626b0bd4e8",
  "discovery_ids": [
    "BT-D011"
  ],
  "source_records": [
    {
      "source_type": "PRIMARY_PAPER",
      "collector_id": "muse-primary-web",
      "collector_run_id": "beyond-text-discovery-r1",
      "observed_at": "2026-09-23T17:30:00Z",
      "title": "Photorealistic Text-to-Image Diffusion Models with Deep Language Understanding (Imagen) (Saharia et al.)",
      "locator": "https://arxiv.org/abs/2205.11487",
      "raw_paths": [
        "sources/SP-beyond-text-2026/raw/discovery-observations-d03-conditioning.md"
      ],
      "published_at": "2022-05",
      "summary_text": "Cascaded diffusion with large frozen text encoders; T5-vs-CLIP encoder finding that anchors conditioning-encoder choices. [retrieval: SUMMARY_CAPTURED; full-body consumption at Evidence stage]",
      "metadata": {
        "lane": "d03",
        "modality": "image",
        "role": "anchor",
        "evidence_boundary": "source-local claims only until Evidence verification",
        "retrieval_status": "SUMMARY_CAPTURED",
        "scope_limitation": "Encoder finding is era-specific; native-multimodal successors differ."
      }
    }
  ],
  "verification_targets": [
    "Evidence-stage full-body verification",
    "TS-002/TS-003 boundary: conditioning machinery only"
  ],
  "screening_basis": {
    "screening_acceptance_sha256": "d8eaabe990ab3420e30bb852909afc684b1339ae9779dab0519c04dacd9ecc1a",
    "decisions": [
      {
        "discovery_id": "BT-D011",
        "decision": "KEEP",
        "scope_tags": [
          "BT-O01",
          "BT-O03"
        ]
      }
    ]
  }
}
