{
  "schema_version": "2.0-rc1",
  "issue_id": "SP-vision-multimodal-2026",
  "evidence_task_id": "evidence:SP-vision-multimodal-2026:85bc25df6171e3dd",
  "discovery_ids": [
    "VM-D019"
  ],
  "source_records": [
    {
      "source_type": "arxiv_primary",
      "collector_id": "muse-primary-web",
      "collector_run_id": "vision-multimodal-discovery-r1",
      "observed_at": "2026-09-30T00:38:52Z",
      "title": "Towards Robust Monocular Depth Estimation / MiDaS (Ranftl et al.)",
      "locator": "https://arxiv.org/abs/1907.01341",
      "raw_paths": [
        "sources/SP-vision-multimodal-2026/raw/discovery-observations-vmo04.md"
      ],
      "published_at": "2019-07",
      "summary_text": "Scale/shift-invariant monocular/relative depth WITHOUT metric calibration; multi-dataset Pareto-mixing; zero-shot cross-dataset transfer as the robustness contract. [retrieval: ARXIV_ABSTRACT_VERIFIED; full-body consumption at Evidence stage]",
      "metadata": {
        "lane": "d04",
        "modality": "image",
        "role": "support-node",
        "x_axes": [
          "X01"
        ],
        "ts_overlap": "TS-001 absent / TS-002 partial (control signals)",
        "retrieval_status": "ARXIV_ABSTRACT_VERIFIED",
        "evidence_boundary": "source-local claims only until Evidence verification",
        "scope_limitation": "Relative depth only; metric claims need other sources.",
        "repo": "https://github.com/isl-org/MiDaS"
      }
    }
  ],
  "verification_targets": [
    "Evidence-stage full-body verification"
  ],
  "screening_basis": {
    "screening_acceptance_sha256": "2b50dd1c205efc957c16a848fe185f9de7fb5eca10a5729c1b58c5bb250e7aff",
    "decisions": [
      {
        "discovery_id": "VM-D019",
        "decision": "KEEP",
        "scope_tags": [
          "VM-O04"
        ]
      }
    ]
  }
}
