{
  "schema_version": "2.0-rc1",
  "issue_id": "SP-vision-multimodal-2026",
  "evidence_task_id": "evidence:SP-vision-multimodal-2026:0eb3420fb03f017e",
  "discovery_ids": [
    "VM-D036"
  ],
  "source_records": [
    {
      "source_type": "arxiv_primary",
      "collector_id": "muse-primary-web",
      "collector_run_id": "vision-multimodal-discovery-r1",
      "observed_at": "2026-09-30T00:38:52Z",
      "title": "Sigmoid Loss for Language Image Pre-Training / SigLIP (Zhai et al.)",
      "locator": "https://arxiv.org/abs/2303.15343",
      "raw_paths": [
        "sources/SP-vision-multimodal-2026/raw/discovery-observations-vmo06.md"
      ],
      "published_at": "2023-03",
      "summary_text": "Sigmoid-loss alignment; SigLIP2-So400m continued inside Qwen3-VL/Omni encoders (2026 reuse fact). [retrieval: ARXIV_ABSTRACT_VERIFIED; full-body consumption at Evidence stage]",
      "metadata": {
        "lane": "d06",
        "modality": "image",
        "role": "encoder-lineage-node",
        "x_axes": [
          "X01"
        ],
        "ts_overlap": "TS-001 partial / TS-002 partial",
        "retrieval_status": "ARXIV_ABSTRACT_VERIFIED",
        "evidence_boundary": "source-local claims only until Evidence verification",
        "scope_limitation": "SigLIP2 exact citation to be bound from Qwen-report references at Evidence."
      }
    }
  ],
  "verification_targets": [
    "Evidence-stage full-body verification",
    "G06 SigLIP2 citation binding"
  ],
  "screening_basis": {
    "screening_acceptance_sha256": "3bc6edb4c60ad6fba40626b0900f6cf5656544b98a95e4b3d4415f049d3f1a94",
    "decisions": [
      {
        "discovery_id": "VM-D036",
        "decision": "KEEP",
        "scope_tags": [
          "VM-O06",
          "VM-O07"
        ]
      }
    ]
  }
}
